{
  "schema_version": 3,
  "submission_state": "ready",
  "target_profile": "sha3-256-r5-prefix-v1",
  "attack_class": "ordinary-collision",
  "rounds": 5,
  "lane": "exploratory",
  "claim": {
    "time_log2": 129,
    "time_unit": "target-compressions",
    "memory_log2_bytes": 137,
    "data_log2": 129,
    "preprocessing_log2": 120,
    "success_probability": 0.5,
    "nonuniform_advice_log2_bytes": 0
  },
  "restrictions": [
    "Messages are exactly 64 bytes, encoded from two independent uniform 256-bit words.",
    "One batch of 1.25*2^128 samples; all repeated messages are retained and charged; no restart.",
    "Uses the complete fixed-zero-state SHA3-256 sponge with 0x06 padding and prefix rounds 0 through 4.",
    "Classical 256-bit word RAM with independent uniform random words; collision lookup uses an open-addressing hash table with linear probing instead of sorting.",
    "Analytical generic construction; no full-scale execution, precomputed collision, or empirical heuristic is claimed.",
    "The nominal reference identifier does not assert an improvement; the conservative scalar bound is 129."
  ],
  "baseline_improved": "sha3-256-r5-nominal-v2",
  "heuristics": [],
  "certificate_manifest": "certificates/manifest.json"
}
